lang,food_name,canonical_name,calorie_range,macros,food_items,judgement_tags,dish_summary,suggestion,is_beverage,is_food,is_active,beverage_base_ml,beverage_full_sugar_carbs,beverage_default_sugar_ratio,beverage_sugar_adjustable,beverage_profile,source,verified_level,image_url,thumb_url,image_source,image_license,reference_used
zh-TW,舒肥雞胸沙拉,舒肥雞胸沙拉,280-360 kcal,"{""carbs"":18,""sodium"":620,""protein"":30,""fat"":12}","[""protein"",""vegetables"",""fiber""]","[""high_protein"",""light_meal""]",Convenience high-protein salad box.,Add one fruit or whole-grain item when used as a main meal.,false,true,true,,,,,{},tw_convenience_seed,2,,,,,catalog
zh-TW,鮪魚玉米飯糰,鮪魚玉米飯糰,220-300 kcal,"{""carbs"":36,""sodium"":520,""protein"":8,""fat"":6}","[""rice"",""tuna"",""corn""]","[""quick_meal""]",Convenience rice ball with tuna and corn.,Pair with tea egg or salad to improve protein and fiber.,false,true,true,,,,,{},tw_convenience_seed,2,,,,,catalog
zh-TW,鮭魚飯糰,鮭魚飯糰,210-290 kcal,"{""carbs"":34,""sodium"":540,""protein"":9,""fat"":6}","[""rice"",""salmon""]","[""quick_meal""]",Convenience salmon rice ball.,Pair with unsweetened soy milk or chicken pack for better satiety.,false,true,true,,,,,{},tw_convenience_seed,2,,,,,catalog
zh-TW,煙燻雞三明治,煙燻雞三明治,300-420 kcal,"{""carbs"":36,""sodium"":760,""protein"":16,""fat"":12}","[""bread"",""chicken"",""vegetables""]","[""balanced""]",Smoked chicken sandwich from convenience store.,Consider low-sodium sides and water to balance sodium intake.,false,true,true,,,,,{},tw_convenience_seed,2,,,,,catalog
zh-TW,全麥蛋沙拉三明治,全麥蛋沙拉三明治,320-430 kcal,"{""carbs"":34,""sodium"":700,""protein"":14,""fat"":14}","[""whole_wheat_bread"",""egg"",""vegetables""]","[""balanced""]",Whole-wheat egg salad sandwich.,Pair with plain yogurt for additional protein.,false,true,true,,,,,{},tw_convenience_seed,2,,,,,catalog
zh-TW,烤雞腿便當,烤雞腿便當,560-720 kcal,"{""carbs"":72,""sodium"":980,""protein"":28,""fat"":22}","[""rice"",""chicken"",""vegetables""]","[""main_meal""]",Convenience roasted chicken bento.,Use half rice if daily calories are tight.,false,true,true,,,,,{},tw_convenience_seed,2,,,,,catalog
zh-TW,茶葉蛋2顆,茶葉蛋2顆,120-170 kcal,"{""carbs"":2,""sodium"":320,""protein"":12,""fat"":9}","[""egg""]","[""high_protein_snack""]",Two tea eggs.,Good side dish for rice ball or salad meals.,false,true,true,,,,,{},tw_convenience_seed,2,,,,,catalog
zh-TW,無糖優格杯,無糖優格杯,90-150 kcal,"{""carbs"":8,""sodium"":70,""protein"":8,""fat"":4}","[""yogurt""]","[""light_snack""]",Plain yogurt cup.,Add nuts or fruit if extra calories are needed.,false,true,true,,,,,{},tw_convenience_seed,2,,,,,catalog
zh-TW,毛豆杯,毛豆杯,110-170 kcal,"{""carbs"":10,""sodium"":220,""protein"":11,""fat"":6}","[""edamame""]","[""high_protein_snack""]",Small edamame cup.,Useful as high-protein snack between meals.,false,true,true,,,,,{},tw_convenience_seed,2,,,,,catalog
zh-TW,綜合生菜沙拉,綜合生菜沙拉,80-180 kcal,"{""carbs"":9,""sodium"":260,""protein"":4,""fat"":8}","[""vegetables"",""dressing""]","[""fiber_boost""]",Mixed green salad.,Pair with protein item to make a complete meal.,false,true,true,,,,,{},tw_convenience_seed,2,,,,,catalog
zh-TW,雞胸肉蛋白餐盒,雞胸肉蛋白餐盒,360-480 kcal,"{""carbs"":34,""sodium"":780,""protein"":32,""fat"":14}","[""chicken_breast"",""rice"",""vegetables""]","[""high_protein"",""main_meal""]",Protein-focused convenience meal box.,Suitable for muscle maintenance and satiety.,false,true,true,,,,,{},tw_convenience_seed,2,,,,,catalog
zh-TW,海苔飯捲,海苔飯捲,330-460 kcal,"{""carbs"":58,""sodium"":700,""protein"":11,""fat"":10}","[""rice"",""seaweed"",""filling""]","[""quick_meal""]",Kimbap-style seaweed rice roll.,Pair with boiled egg or tofu for better protein ratio.,false,true,true,,,,,{},tw_convenience_seed,2,,,,,catalog
zh-TW,蕎麥冷麵,蕎麥冷麵,320-460 kcal,"{""carbs"":56,""sodium"":860,""protein"":12,""fat"":8}","[""buckwheat_noodle"",""sauce""]","[""main_meal""]",Convenience chilled buckwheat noodles.,Add extra protein side to improve meal balance.,false,true,true,,,,,{},tw_convenience_seed,2,,,,,catalog
zh-TW,味噌豆腐湯,味噌豆腐湯,90-170 kcal,"{""carbs"":8,""sodium"":720,""protein"":8,""fat"":5}","[""tofu"",""miso"",""broth""]","[""side_dish""]",Miso tofu soup cup.,"Treat as side dish, not a standalone main meal.",false,true,true,,,,,{},tw_convenience_seed,2,,,,,catalog
zh-TW,雞肉蔬菜湯,雞肉蔬菜湯,140-240 kcal,"{""carbs"":10,""sodium"":680,""protein"":14,""fat"":8}","[""chicken"",""vegetables"",""broth""]","[""side_dish""]",Chicken and vegetable soup.,Pair with carb source if used for lunch/dinner.,false,true,true,,,,,{},tw_convenience_seed,2,,,,,catalog
zh-TW,玉米濃湯(小),玉米濃湯(小),120-210 kcal,"{""carbs"":20,""sodium"":520,""protein"":4,""fat"":6}","[""corn"",""milk"",""broth""]","[""side_dish""]",Small corn chowder cup.,Use as side dish to avoid high sodium concentration.,false,true,true,,,,,{},tw_convenience_seed,2,,,,,catalog
zh-TW,雞胸肉捲餅,雞胸肉捲餅,320-460 kcal,"{""carbs"":38,""sodium"":760,""protein"":20,""fat"":13}","[""tortilla"",""chicken"",""vegetables""]","[""balanced""]",Chicken wrap from convenience store.,Pair with unsweetened drink and avoid extra sugary snacks.,false,true,true,,,,,{},tw_convenience_seed,2,,,,,catalog
zh-TW,鮪魚蛋三明治,鮪魚蛋三明治,320-440 kcal,"{""carbs"":35,""sodium"":780,""protein"":16,""fat"":15}","[""bread"",""tuna"",""egg""]","[""balanced""]",Tuna and egg sandwich.,Can be breakfast main meal with a low-sugar side.,false,true,true,,,,,{},tw_convenience_seed,2,,,,,catalog
